{
  "type": "device.state.report",
  "timestamp": "2026-03-20T10:08:01Z",
  "session_id": "550e8400-e29b-41d4-a716-446655440000",
  "sequence": 207,
  "version": "1.0",
  "payload": {
    "request_id": "hw-state-001",
    "source": "webui.hardware_test",
    "uptime_ms": 182345,
    "rssi": -56,
    "free_heap_bytes": 198432,
    "current_angle_x_deg": 3.0,
    "current_angle_y_deg": -5.0,
    "calibration": {
      "x": {
        "center_offset_deg": 0,
        "min_deg": -45,
        "max_deg": 45,
        "invert": false,
        "speed_limit_deg_per_sec": 60,
        "soft_start": true,
        "home_deg": 0
      },
      "y": {
        "center_offset_deg": 0,
        "min_deg": -35,
        "max_deg": 35,
        "invert": false,
        "speed_limit_deg_per_sec": 60,
        "soft_start": true,
        "home_deg": 0
      }
    },
    "mic_level": 0,
    "speaker_busy": false,
    "camera_available": false,
    "firmware_version": "stackchan-cores3-01"
  }
}
